{
  "type": "terminal_authorization",
  "pos_ref": "nostr:30380:aaaaaaaaaaaaaaaaaaaaaaaaaaaaaaaaaaaaaaaaaaaaaaaaaaaaaaaaaaaaaaaa:seguras-butcher",
  "terminal_pubkey": "23cf0f49b6f5db3c6ef008a0df8918df95e4436bda46e5b9d67b8b7c9d5f5bb1",
  "terminal_id": "0123456789abcdef0123456789abcdef",
  "terminal_name": "Counter 1",
  "pairing_code_hint": "4F7G-YJDP",
  "network": "liquid-mainnet",
  "asset": "L-BTC",
  "settlement": {
    "type": "liquid_ct_descriptor",
    "ct_descriptor": "ct(slip77(00),elwpkh([00000000/84h/1776h/0h]xpub-demo/0/*))",
    "descriptor_fingerprint": "demo-fingerprint",
    "terminal_branch": 17,
    "lookahead": 50
  },
  "limits": {
    "max_invoice_sat": 100000,
    "daily_volume_sat": 1000000,
    "allow_lightning": true,
    "allow_liquid": true,
    "allow_bolt_card": true
  },
  "claim_mode": "standard",
  "swap_providers": [
    {
      "id": "boltz-mainnet",
      "type": "boltz",
      "api_base": "https://api.boltz.exchange",
      "ws_url": "wss://api.boltz.exchange/v2/ws"
    }
  ],
  "liquid_backends": [
    {
      "type": "esplora",
      "url": "https://liquid.bullbitcoin.com/api"
    }
  ],
  "merchant_recovery_pubkey": "bbbbbbbbbbbbbbbbbbbbbbbbbbbbbbbbbbbbbbbbbbbbbbbbbbbbbbbbbbbbbbbb",
  "sale_bucket_secret": "cccccccccccccccccccccccccccccccccccccccccccccccccccccccccccccccc",
  "sale_bucket_generation": 1,
  "effective_from_epoch_day": 19800,
  "expires_at": 1790000000
}
